{
  "plot_type": "scatterplot_with_regression",
  "input_table": "panel_A_bill_dimensions.csv",
  "mapping": {
    "x": "bill_length_mm",
    "y": "bill_depth_mm",
    "color": "species",
    "fit_line": true
  },
  "journal_style": "publication",
  "output": {
    "formats": [
      "svg",
      "png",
      "pdf"
    ],
    "width_mm": 89.0,
    "height_mm": 70.0,
    "dpi": 300
  },
  "layout": {
    "column_width": "onehalf",
    "x_label": "Bill length (mm)",
    "y_label": "Bill depth (mm)",
    "title": "Bill dimensions by species",
    "legend_outside": true
  }
}