{
  "plot_type": "upset_plot",
  "input_table": "data.csv",
  "mapping": {
    "sets": [
      "DEG_up",
      "DEG_down",
      "Promoter_peak",
      "Conserved"
    ]
  },
  "journal_style": "publication",
  "output": {
    "formats": [
      "svg",
      "png",
      "pdf"
    ],
    "width_mm": 89,
    "height_mm": 70,
    "dpi": 300
  },
  "layout": {
    "column_width": "double"
  }
}