{
  "plot_type": "scatterplot_with_regression",
  "input_table": "penguins_isotopes.csv",
  "mapping": {
    "x": "d13C",
    "y": "d15N",
    "color": "species"
  },
  "journal_style": "publication",
  "output": {
    "formats": [
      "svg",
      "png",
      "pdf"
    ],
    "width_mm": 89.0,
    "height_mm": 70.0,
    "dpi": 300
  },
  "layout": {
    "title": "Stable isotope ratios",
    "x_label": "\u03b4$^{13}$C (\u2030)",
    "y_label": "\u03b4$^{15}$N (\u2030)"
  }
}