{
  "plot_type": "calibration_plot",
  "input_table": "digits_calibration.csv",
  "mapping": {
    "label": "true_label",
    "prob": "predicted_prob",
    "n_bins": 10
  },
  "journal_style": "publication",
  "output": {
    "formats": [
      "svg",
      "png",
      "pdf"
    ],
    "width_mm": 89.0,
    "height_mm": 70.0,
    "dpi": 300
  },
  "layout": {
    "column_width": "onehalf",
    "title": "Digit-0 detector calibration (5-fold CV)",
    "legend_outside": true
  }
}