{
  "plot_type": "scatterplot_with_regression",
  "input_table": "diabetes_scatter.csv",
  "mapping": {
    "x": "bmi",
    "y": "disease_progression",
    "fit_line": true
  },
  "journal_style": "publication",
  "output": {
    "formats": [
      "svg",
      "png",
      "pdf"
    ],
    "width_mm": 89.0,
    "height_mm": 70.0,
    "dpi": 300
  },
  "layout": {
    "column_width": "onehalf",
    "x_label": "Body mass index",
    "y_label": "Disease progression (1 yr)",
    "title": "BMI vs disease progression",
    "legend_outside": true
  }
}