{
  "plot_type": "sankey_plot",
  "input_table": "data.csv",
  "mapping": {
    "source": "baseline_response",
    "target": "outcome",
    "value": "n_patients"
  },
  "journal_style": "publication",
  "output": {
    "formats": [
      "svg",
      "png",
      "pdf"
    ],
    "width_mm": 89,
    "height_mm": 70,
    "dpi": 300
  },
  "layout": {
    "column_width": "double"
  }
}