{
  "plot_type": "stacked_bar_composition",
  "input_table": "data.csv",
  "mapping": {
    "x": "sample_id",
    "stack": "cell_type",
    "y": "fraction",
    "facet_or_sort_by": "group"
  },
  "journal_style": "nature_like",
  "output": {
    "formats": [
      "svg",
      "png",
      "pdf"
    ],
    "width_mm": 89,
    "height_mm": 70,
    "dpi": 300
  },
  "layout": {
    "column_width": "single"
  }
}