{
  "plot_type": "dose_response_curve",
  "input_table": "data.csv",
  "mapping": {
    "dose": "concentration_uM",
    "response": "viability_pct",
    "group": "drug",
    "fit": true
  },
  "journal_style": "nature_like",
  "output": {
    "formats": [
      "svg",
      "png",
      "pdf"
    ],
    "width_mm": 89,
    "height_mm": 70,
    "dpi": 300
  },
  "layout": {
    "column_width": "single"
  }
}