{
  "plot_type": "ma_plot",
  "input_table": "data.csv",
  "mapping": {
    "x": "AveExpr",
    "y": "logFC",
    "p": "adj.P.Val",
    "label": "gene",
    "p_cutoff": 0.05,
    "label_top_n": 8
  },
  "journal_style": "nature_like",
  "output": {
    "formats": [
      "svg",
      "png",
      "pdf"
    ],
    "width_mm": 89,
    "height_mm": 70,
    "dpi": 300
  },
  "layout": {
    "column_width": "single"
  }
}