{
  "plot_type": "dot_strip_plot",
  "input_table": "data.csv",
  "mapping": {
    "x": "group",
    "y": "value",
    "summary": "mean",
    "jitter": true
  },
  "journal_style": "nature_like",
  "output": {
    "formats": [
      "svg",
      "png",
      "pdf"
    ],
    "width_mm": 89,
    "height_mm": 70,
    "dpi": 300
  },
  "layout": {
    "column_width": "single"
  }
}